2017-04-29T01:36:15+00:00 eb7d66f590f6#00 I: Runner: processes
2017-04-29T01:36:15+00:00 eb7d66f590f6#00 I: Chooser: simple
2017-04-29T01:36:15+00:00 eb7d66f590f6#00 I: Configuration suite_name = "Interp"
2017-04-29T01:36:15+00:00 eb7d66f590f6#00 I: Configuration cache_filename = "/home/patrick/dev/src/github.com/Logiraptor/elang/_build/oUnit-$(suite_name).cache"
2017-04-29T01:36:15+00:00 eb7d66f590f6#00 I: Configuration display = "true"
2017-04-29T01:36:15+00:00 eb7d66f590f6#00 I: Configuration results_style_1_X = "false"
2017-04-29T01:36:15+00:00 eb7d66f590f6#00 I: Configuration verbose = "false"
2017-04-29T01:36:15+00:00 eb7d66f590f6#00 I: Configuration health_check_interval = "1."
2017-04-29T01:36:15+00:00 eb7d66f590f6#00 I: Configuration testdata_dir = "none"
2017-04-29T01:36:15+00:00 eb7d66f590f6#00 I: Configuration chooser = "simple"
2017-04-29T01:36:15+00:00 eb7d66f590f6#00 I: Configuration output_html_dir = "none"
2017-04-29T01:36:15+00:00 eb7d66f590f6#00 I: Configuration processes_kill_period = "5."
2017-04-29T01:36:15+00:00 eb7d66f590f6#00 I: Configuration runner = "processes"
2017-04-29T01:36:15+00:00 eb7d66f590f6#00 I: Configuration shards = "4"
2017-04-29T01:36:15+00:00 eb7d66f590f6#00 I: Configuration processes_grace_period = "5."
2017-04-29T01:36:15+00:00 eb7d66f590f6#00 I: Configuration log_encoding = "utf-8"
2017-04-29T01:36:15+00:00 eb7d66f590f6#00 I: Configuration output_junit_file = "none"
2017-04-29T01:36:15+00:00 eb7d66f590f6#00 I: Configuration output_file = "/home/patrick/dev/src/github.com/Logiraptor/elang/_build/oUnit-$(suite_name)-$(shard_id).log"
2017-04-29T01:36:15+00:00 eb7d66f590f6#00 I: Using 4 workers maximum.
2017-04-29T01:36:15+00:00 eb7d66f590f6#00 I: Starting worker number eb7d66f590f6#01.
2017-04-29T01:36:15+00:00 eb7d66f590f6#00 I: Worker eb7d66f590f6#01 started.
2017-04-29T01:36:15+00:00 eb7d66f590f6#00 I: Still 1 tests running : Interp:0:can interpret constant integers.
2017-04-29T01:36:15+00:00 eb7d66f590f6#00 I: 1 tests running: Interp:0:can interpret constant integers.
2017-04-29T01:36:15+00:00 eb7d66f590f6#01 I: Start test Interp:0:can interpret constant integers.
2017-04-29T01:36:15+00:00 eb7d66f590f6#00 I: Still 1 tests running : Interp:0:can interpret constant integers.
2017-04-29T01:36:15+00:00 eb7d66f590f6#00 I: 1 tests running: Interp:0:can interpret constant integers.
2017-04-29T01:36:15+00:00 eb7d66f590f6#01 E: Test Interp:0:can interpret constant integers exited with an error.
2017-04-29T01:36:15+00:00 eb7d66f590f6#01 E: test `anon_test_1`
2017-04-29T01:36:15+00:00 eb7d66f590f6#01 E: raised exception `OUnitTest.OUnit_failure("expected: ((Int 1)) but got: ((Int 0))")`
2017-04-29T01:36:15+00:00 eb7d66f590f6#01 E: on `0 (after 62 shrink steps)`
2017-04-29T01:36:15+00:00 eb7d66f590f6#01 E: Raised at file "src/oUnitAssert.ml", line 45, characters 8-27
2017-04-29T01:36:15+00:00 eb7d66f590f6#01 E: Called from file "src/QCheck.ml", line 839, characters 13-33
2017-04-29T01:36:15+00:00 eb7d66f590f6#01 E:  in test Interp:0:can interpret constant integers.
2017-04-29T01:36:15+00:00 eb7d66f590f6#01 E: Raised at file "src/QCheck.ml", line 931, characters 12-66
2017-04-29T01:36:15+00:00 eb7d66f590f6#01 E: Called from file "src/oUnitRunner.ml", line 46, characters 13-26
2017-04-29T01:36:15+00:00 eb7d66f590f6#01 E: 
2017-04-29T01:36:15+00:00 eb7d66f590f6#00 I: Still 1 tests running : Interp:0:can interpret constant integers.
2017-04-29T01:36:15+00:00 eb7d66f590f6#00 I: 1 tests running: Interp:0:can interpret constant integers.
2017-04-29T01:36:15+00:00 eb7d66f590f6#01 I: End test Interp:0:can interpret constant integers.
2017-04-29T01:36:15+00:00 eb7d66f590f6#00 I: Still 1 tests running : Interp:0:can interpret constant integers.
2017-04-29T01:36:15+00:00 eb7d66f590f6#00 I: 1 tests running: Interp:0:can interpret constant integers.
2017-04-29T01:36:15+00:00 eb7d66f590f6#00 I: 0 tests running: .
2017-04-29T01:36:15+00:00 eb7d66f590f6#00 I: Worker eb7d66f590f6#01 has ended.
2017-04-29T01:36:15+00:00 eb7d66f590f6#00 I: Used 1 worker during test execution.
2017-04-29T01:36:15+00:00 eb7d66f590f6#00 I: Run 1 tests with shard eb7d66f590f6#01.
2017-04-29T01:36:15+00:00 eb7d66f590f6#00 I: ==============
2017-04-29T01:36:15+00:00 eb7d66f590f6#00 I: Summary:
2017-04-29T01:36:15+00:00 eb7d66f590f6#00 E: Test Interp:0:can interpret constant integers exited with an error.
2017-04-29T01:36:15+00:00 eb7d66f590f6#00 E: test `anon_test_1`
2017-04-29T01:36:15+00:00 eb7d66f590f6#00 E: raised exception `OUnitTest.OUnit_failure("expected: ((Int 1)) but got: ((Int 0))")`
2017-04-29T01:36:15+00:00 eb7d66f590f6#00 E: on `0 (after 62 shrink steps)`
2017-04-29T01:36:15+00:00 eb7d66f590f6#00 E: Raised at file "src/oUnitAssert.ml", line 45, characters 8-27
2017-04-29T01:36:15+00:00 eb7d66f590f6#00 E: Called from file "src/QCheck.ml", line 839, characters 13-33
2017-04-29T01:36:15+00:00 eb7d66f590f6#00 E:  in test Interp:0:can interpret constant integers.
2017-04-29T01:36:15+00:00 eb7d66f590f6#00 E: Raised at file "src/QCheck.ml", line 931, characters 12-66
2017-04-29T01:36:15+00:00 eb7d66f590f6#00 E: Called from file "src/oUnitRunner.ml", line 46, characters 13-26
2017-04-29T01:36:15+00:00 eb7d66f590f6#00 E: 
2017-04-29T01:36:15+00:00 eb7d66f590f6#00 I: Ran: 1 tests in: 0.12 seconds.
2017-04-29T01:36:15+00:00 eb7d66f590f6#00 I: Cases: 1.
2017-04-29T01:36:15+00:00 eb7d66f590f6#00 I: Tried: 1.
2017-04-29T01:36:15+00:00 eb7d66f590f6#00 I: Errors: 1.
2017-04-29T01:36:15+00:00 eb7d66f590f6#00 I: Failures: 0.
2017-04-29T01:36:15+00:00 eb7d66f590f6#00 I: Skip: 0.
2017-04-29T01:36:15+00:00 eb7d66f590f6#00 I: Todo: 0.
2017-04-29T01:36:15+00:00 eb7d66f590f6#00 I: Timeout: 0.
